{
  "version": 1,
  "updated_at": "2026-05-24T10:00:00.000000+00:00",
  "sha256": "06381981289c61e2d27b8d025bd8e7a7a21f67ec571fb554f674bfeaee8b2da9",
  "state": {
    "192.0.2.30:10485512": "2026-05-17T01:06:08.767584+00:00",
    "2001:db8::1:10407915": "2026-05-17T01:06:10.238528+00:00",
    "cf-waf:192.0.2.31:2026-05-17": "2026-05-17T02:46:10.686539+00:00",
    "cf-waf:192.0.2.32:2026-05-17": "2026-05-17T04:51:24.017289+00:00",
    "192.0.2.33:10537454": "2026-05-17T05:51:02.912584+00:00",
    "192.0.2.33:3641": "2026-05-17T05:51:03.587859+00:00",
    "modsec:192.0.2.34:2026-05-18": "2026-05-18T10:43:12.000000+00:00",
    "waf:192.0.2.35:2026-04-09": "2026-04-09T21:31:15.000000+00:00"
  }
}
