{
  "version": 1,
  "updated_at": "2026-05-24T10:00:00.000000+00:00",
  "sha256": "2a2b7a7228c17104b59ccbff5a9356bc9c3240df9e67ff7612d44ccea38522f1",
  "state": {
    "192.0.2.10": {
      "count": 2,
      "last_seen": "2026-05-22T02:22:25Z"
    },
    "192.0.2.11": {
      "count": 1,
      "last_seen": "2026-05-17T11:37:21.267011+00:00"
    },
    "192.0.2.12": {
      "count": 127,
      "last_seen": "2026-05-17T09:37:43Z"
    },
    "192.0.2.13": {
      "count": 90,
      "last_seen": "2026-05-22T08:03:25.507764+00:00"
    },
    "_cursor": "2026-05-22T08:05:00.000000+00:00"
  }
}
